{
  "$schema": "https://json-schema.org/draft/2020-12/schema",
  "$id": "urn:dppce:profile:battery:item:v1",
  "title": "Synthetic item-level battery passport",
  "$comment": "Project-authored illustrative schema. Not derived from a standard or a law.",
  "type": "object",
  "additionalProperties": false,
  "required": [
    "@context",
    "id",
    "type",
    "granularity",
    "model",
    "category",
    "operator",
    "manufactured",
    "rated_capacity",
    "remaining_capacity",
    "state_of_health_percent",
    "status",
    "version",
    "updated_at"
  ],
  "properties": {
    "@context": {
      "type": "array",
      "minItems": 1,
      "items": {
        "type": "string",
        "format": "uri"
      }
    },
    "id": {
      "type": "string",
      "format": "uri"
    },
    "type": {
      "const": "BatteryPassport"
    },
    "granularity": {
      "const": "item"
    },
    "model": {
      "type": "string",
      "format": "uri"
    },
    "category": {
      "enum": [
        "ev",
        "lmt",
        "industrial"
      ]
    },
    "operator": {
      "type": "object",
      "additionalProperties": false,
      "required": [
        "name",
        "identifier"
      ],
      "properties": {
        "name": {
          "type": "string",
          "minLength": 1
        },
        "identifier": {
          "type": "string",
          "minLength": 1
        }
      }
    },
    "manufactured": {
      "type": "string",
      "pattern": "^\\d{4}-\\d{2}-\\d{2}$"
    },
    "rated_capacity": {
      "type": "object",
      "additionalProperties": false,
      "required": [
        "value",
        "unit"
      ],
      "properties": {
        "value": {
          "type": "integer",
          "minimum": 0
        },
        "unit": {
          "type": "string"
        }
      }
    },
    "remaining_capacity": {
      "type": "object",
      "additionalProperties": false,
      "required": [
        "value",
        "unit"
      ],
      "properties": {
        "value": {
          "type": "integer",
          "minimum": 0
        },
        "unit": {
          "type": "string"
        }
      }
    },
    "state_of_health_percent": {
      "type": "integer"
    },
    "status": {
      "enum": [
        "original",
        "repurposed",
        "re-used",
        "remanufactured",
        "waste"
      ]
    },
    "version": {
      "type": "integer",
      "minimum": 1
    },
    "updated_at": {
      "type": "string",
      "pattern": "^\\d{4}-\\d{2}-\\d{2}T\\d{2}:\\d{2}:\\d{2}Z$"
    },
    "restricted": {
      "type": "object",
      "additionalProperties": false,
      "properties": {
        "dismantling_notes": {
          "type": "string"
        },
        "supplier_reference": {
          "type": "string"
        }
      }
    }
  }
}
